<?xml version="1.0"?>
<!DOCTYPE book SYSTEM "../../style/dtd/book.dtd">

<book title="Test Documentation" copyright="1999 Apache Software Foundation">
  <document id="readme"     label="Readme"     source="readme.xml"    />
  <document id="sections"   label="Sections"   source="sections.xml"  />
  <separator                                                          />
  <document id="blocks"     label="Blocks"     source="blocks.xml"    />
  <document id="characters" label="Characters" source="characters.xml"/>
  <document id="links"      label="Links"      source="links.xml"     />
  <separator                                                          />
  <faqs     id="faqs"       label="FAQ File"   source="faqs.xml"      />
<hidden>
  <group    id="faqgroup"   label="FAQ Group"                          >
    <entry  id="faqs-1"                        source="faqs-1.xml"    />
    <entry  id="faqs-2"                        source="faqs-2.xml"    />
  </group                                                              >    
</hidden>
  <changes  id="changes"    label="Changes"    source="changes.xml"   />
</book>
